{
  "$schema": "https://json-schema.org/draft/2020-12/schema",
  "$id": "https://outreach.local/schemas/outreach-secrets.json",
  "title": "Outreach consolidated secrets",
  "type": "object",
  "additionalProperties": false,
  "required": ["development_api_key", "release_api_key", "google_services"],
  "properties": {
    "development_api_key": {
      "type": "string",
      "minLength": 1,
      "description": "Maps Platform API key for debug builds; setup-secrets writes MAPS_API_KEY_DEBUG in local.properties; Gradle debug buildType uses it for google_maps_key. Enable Directions API on the same Cloud project/key for arrival/route info."
    },
    "release_api_key": {
      "type": "string",
      "minLength": 1,
      "description": "Maps Platform API key for release builds; setup-secrets writes MAPS_API_KEY_RELEASE; Gradle release buildType uses it for google_maps_key."
    },
    "google_services": {
      "type": "object",
      "description": "Must match the structure of Firebase android/google-services.json.",
      "required": ["project_info", "client"],
      "properties": {
        "project_info": { "type": "object" },
        "client": { "type": "array" },
        "configuration_version": { "type": "string" }
      }
    },
    "google_service_info_plist": {
      "type": "string",
      "description": "Optional. Full XML contents of the Firebase iOS GoogleService-Info.plist; ios/scripts/setup-secrets.sh writes to ios/Outreach/Outreach/GoogleService-Info.plist. Prefer google_service_info_plist_base64 for a single-line value without escaping newlines in JSON."
    },
    "google_service_info_plist_base64": {
      "type": "string",
      "description": "Optional. Base64 of GoogleService-Info.plist (recommended for consolidated JSON: base64 -i GoogleService-Info.plist | tr -d '\\n' ). ios/scripts/setup-secrets.sh decodes this to the gitignored plist path."
    },
    "android_upload_signing": {
      "type": "object",
      "description": "Upload keystore passwords for CI when using secrets/upload-keystore.jks.age (same passphrase as outreach-secrets.json.age). Omit for GitHub ANDROID_UPLOAD_* secrets-only signing.",
      "additionalProperties": false,
      "required": ["key_alias", "keystore_password", "key_password"],
      "properties": {
        "key_alias": {
          "type": "string",
          "minLength": 1,
          "description": "Key alias inside the PKCS12 upload keystore."
        },
        "keystore_password": {
          "type": "string",
          "minLength": 1,
          "description": "Keystore password for bundleRelease signing."
        },
        "key_password": {
          "type": "string",
          "minLength": 1,
          "description": "Private key password (often same as keystore password)."
        }
      }
    },
    "development_env": {
      "type": "object",
      "description": "Optional string map merged from ~/etc/development.env by scripts/merge-development-env-into-secrets.sh. Not read by setup-secrets.sh unless you add consumers.",
      "additionalProperties": { "type": "string" }
    }
  }
}
