{
  "development_api_key": "YOUR_GOOGLE_MAPS_PLATFORM_API_KEY_DEV",
  "release_api_key": "YOUR_GOOGLE_MAPS_PLATFORM_API_KEY_RELEASE",
  "google_services": {
    "project_info": {
      "project_number": "123456789012",
      "project_id": "outreach-placeholder",
      "storage_bucket": "outreach-placeholder.appspot.com"
    },
    "client": [
      {
        "client_info": {
          "mobilesdk_app_id": "1:123456789012:android:abcdef1234567890",
          "android_client_info": {
            "package_name": "org.outreach.app"
          }
        },
        "oauth_client": [],
        "api_key": [
          {
            "current_key": "AIzaSyPlaceholderReplaceForProd"
          }
        ],
        "services": {
          "appinvite_service": {
            "other_platform_oauth_client": []
          }
        }
      }
    ],
    "configuration_version": "1"
  },
  "android_upload_signing": {
    "key_alias": "upload",
    "keystore_password": "REPLACE_WITH_UPLOAD_KEYSTORE_PASSWORD",
    "key_password": "REPLACE_WITH_UPLOAD_KEY_PASSWORD"
  }
}
